{
    "id": "cours_eau",
    "label": "Cours d'eau",
    "tooltipMode": "hover",
    "zIndex": 20,
    "interactiveShape": true,
    "geometry": "line",
    "data": {
        "ogcApi": {
            "url": "https://data.geopf.fr/ogcapi/collections/BDTOPO_V3:cours_d_eau/items",
            "bbox": [-54.6, 2.1, -51.6, 5.8],
            "limit": 500,
            "maxFeatures": 5000,
            "autoRefresh": false
        },
        "directory": "data",
        "licence": "Licence Ouverte v2.0 — IGN BD TOPO® v3 (data.geopf.fr)"
    },
    "styles": {
        "directory": "styles",
        "default": "defaut.json",
        "available": [
            {
                "id": "defaut",
                "label": "Défaut",
                "file": "defaut.json"
            }
        ]
    },
    "tooltip": {
        "mode": "hover",
        "fields": [
            { "field": "properties.toponyme", "label": "Nom" },
            { "field": "properties.classe_de_largeur", "label": "Largeur" }
        ]
    },
    "table": {
        "enabled": true,
        "columns": [
            { "field": "properties.toponyme", "label": "Nom", "sortable": true, "width": "50%" },
            { "field": "properties.classe_de_largeur", "label": "Largeur", "sortable": true, "width": "25%" },
            { "field": "properties.regime", "label": "Régime", "sortable": true, "width": "25%" }
        ],
        "searchFields": ["properties.toponyme"],
        "defaultSort": { "field": "properties.toponyme", "order": "asc" }
    },
    "clustering": {
        "enabled": false
    }
}
