{
    "id": "cours_eau_risque",
    "label": "Cours d'eau à risque",
    "tooltipMode": "hover",
    "zIndex": 20,
    "interactiveShape": true,
    "geometry": "line",
    "data": {
        "dataUrl": "https://data.geopf.fr/wfs/ows?service=WFS&version=2.0.0&request=GetFeature&typeName=BDTOPO_V3:cours_d_eau&outputFormat=application/json&count=5000&srsName=EPSG:4326&bbox=-5.5,41.0,9.8,51.5,EPSG:4326",
        "directory": "data",
        "licence": "Licence Ouverte v2.0 — IGN BD TOPO® v3 (data.geopf.fr)"
    },
    "styles": {
        "directory": "styles",
        "default": "defaut.json",
        "available": [
            {
                "id": "defaut",
                "label": "Défaut",
                "file": "defaut.json"
            }
        ]
    },
    "tooltip": {
        "mode": "hover",
        "fields": [
            { "field": "properties.toponyme", "label": "Nom" },
            { "field": "properties.classe_de_largeur", "label": "Largeur" },
            { "field": "properties.regime", "label": "Régime" }
        ]
    },
    "table": {
        "enabled": true,
        "columns": [
            { "field": "properties.toponyme", "label": "Nom", "sortable": true, "width": "40%" },
            {
                "field": "properties.classe_de_largeur",
                "label": "Largeur",
                "sortable": true,
                "width": "20%"
            },
            { "field": "properties.regime", "label": "Régime", "sortable": true, "width": "20%" },
            {
                "field": "properties.etat_de_l_objet",
                "label": "État",
                "sortable": true,
                "width": "20%"
            }
        ],
        "searchFields": ["properties.toponyme"],
        "defaultSort": { "field": "properties.toponyme", "order": "asc" }
    },
    "clustering": {
        "enabled": false
    }
}
