{
    "id": "tri_extreme",
    "label": "TRI — Scénario extrême",
    "tooltipMode": "hover",
    "zIndex": 12,
    "interactiveShape": true,
    "geometry": "polygon",
    "data": {
        "dataUrl": "https://catalogue.sigloire.fr/api/data/4056c24b-e01e-4508-aff9-ec21ef478fd0?srs=EPSG:4326",
        "directory": "data",
        "licence": "Licence Ouverte v2.0 — SIGLoire / DREAL Pays de la Loire (sigloire.fr) — données régionales démonstratives en attendant endpoint national TRI"
    },
    "styles": {
        "directory": "styles",
        "default": "defaut.json",
        "available": [
            {
                "id": "defaut",
                "label": "Défaut",
                "file": "defaut.json"
            }
        ]
    },
    "tooltip": {
        "mode": "hover",
        "fields": [
            { "field": "properties.nom_tri", "label": "TRI" },
            { "field": "properties.gid", "label": "ID" }
        ]
    },
    "table": {
        "enabled": true,
        "columns": [
            { "field": "properties.nom_tri", "label": "TRI", "sortable": true, "width": "70%" },
            { "field": "properties.gid", "label": "ID", "sortable": true, "width": "30%" }
        ],
        "searchFields": ["properties.nom_tri"],
        "defaultSort": { "field": "properties.nom_tri", "order": "asc" }
    },
    "clustering": {
        "enabled": false
    }
}
