{
  "id": "eco_regions",
  "label": "Eco régions",
  "zIndex": 50,
  "interactiveShape": false,
  "tooltip": {
    "mode": "hover",
    "fields": [
      { "type": "text", "field": "properties.ecorregion" }
    ]
  },
  "geometry": "polygon",
  "data": {
    "directory": "data",
    "file": "eco_regions.geojson",
    "vectorTiles": {
      "enabled": true,
      "tilesDirectory": "tiles",
      "layerName": "eco_regions",
      "minZoom": 0,
      "maxNativeZoom": 14,
      "maxZoom": 18,
      "interactive": true
    }
  },
  "styles": {
    "directory": "styles",
    "default": "defaut.json",
    "available": [
      {
        "id": "defaut",
        "label": "défaut",
        "file": "defaut.json"
      }
    ]
  },
  "table": {
    "enabled": false
  },

  "clustering": {
    "enabled": false,
    "maxClusterRadius": 80,
    "disableClusteringAtZoom": 12
  }
}
