{
  "id": "zones_de_conservation_wdpa",
  "label": "Zones de conservation WDPA",
  "zIndex": 51,
  "geometry": "polygon",
  "interactiveShape": false,
  "tooltip": {
    "mode": "hover",
    "fields": [
      {
        "type": "text",
        "field": "properties.NAME"
      }
    ]
  },
  "popup": {
    "enabled": false
  },
  "data": {
    "directory": "data",
    "file": "zones_de_conservation_wdpa.geojson",
    "vectorTiles": {
      "enabled": true,
      "tilesDirectory": "tiles",
      "layerName": "zones_de_conservation_wdpa",
      "minZoom": 0,
      "maxNativeZoom": 14,
      "maxZoom": 18,
      "interactive": true
    }
  },
  "styles": {
    "directory": "styles",
    "default": "defaut.json",
    "available": [
      {
        "id": "defaut",
        "label": "défaut",
        "file": "defaut.json"
      }
    ]
  },
  "table": {
    "enabled": false
  },
  "clustering": {
    "enabled": false,
    "maxClusterRadius": 80,
    "disableClusteringAtZoom": 12
  }
}
