{
  "id": "temperature_juillet",
  "label": "Température - Juillet",
  "zIndex": 64,
  "interactiveShape": false,
  "tooltip": { "mode": "never" },
  "geometry": "polygon",
  "data": {
    "directory": "data",
    "file": "temperature_juillet.geojson"
  },
  "styles": {
    "directory": "styles",
    "default": "defaut.json",
    "available": [
      {
        "id": "defaut",
        "label": "défaut",
        "file": "defaut.json"
      }
    ]
  },
  "table": {
    "enabled": false
  },
  "clustering": {
    "enabled": false,
    "maxClusterRadius": 80,
    "disableClusteringAtZoom": 12
  }
}
